{
  "schemaVersion": 1,
  "id": "49733509-d65b-4cfa-b7e6-b64928dc0141",
  "slug": "task.change-spacetimedb-reducer-domain-slice",
  "name": "Change SpacetimeDB Reducer Domain Slice",
  "title": "Implement or Change a SpacetimeDB Reducer/Domain Slice",
  "status": "ready",
  "version": "1.0.0",
  "summary": "Implementation-grade guidance for adding or changing a SpacetimeDB reducer backed by explicit domain, repository, mapper, and table boundaries.",
  "description": "Use this task when a SpacetimeDB Rust module needs a new reducer, table-backed mutation, or domain slice change.",
  "tags": [
    { "tagId": "tag.language", "value": "rust" },
    { "tagId": "tag.framework", "value": "spacetimedb" },
    { "tagId": "tag.stack", "value": "rust-spacetimedb" },
    { "tagId": "tag.task-intent", "value": "implement-feature" },
    { "tagId": "tag.topic", "value": "reducer" }
  ],
  "metadata": {
    "reusable": true,
    "scope": "library-task"
  },
  "inputSchema": {
    "type": "object",
    "additionalProperties": false,
    "required": ["sliceName", "reducerName", "behavior", "testCommand"],
    "properties": {
      "sliceName": { "type": "string", "minLength": 1 },
      "reducerName": { "type": "string", "minLength": 1 },
      "behavior": { "type": "string", "minLength": 1 },
      "testCommand": { "type": "string", "minLength": 1 }
    }
  },
  "context": {
    "ppp": {
      "requiredSlugs": [
        "principle.explicit-boundaries",
        "architecture.spacetimedb-domain-module",
        "pattern.spacetimedb-reducer-domain-adapter",
        "pattern.spacetimedb-repository-mapper-boundary",
        "stack.rust-spacetimedb",
        "validation.spacetimedb-domain-slice-checks",
        "antipattern.spacetimedb-domain-hidden-in-reducer"
      ],
      "includeRelated": true,
      "includeBody": true,
      "sectionTypes": ["guidance", "solution", "rules", "checks", "anti-patterns", "examples", "references"],
      "blockTypes": ["markdown", "list", "checklist", "code", "ppp-ref"]
    }
  },
  "outputs": [
    { "id": "domain", "type": "code", "title": "Domain behavior", "description": "Aggregate, service, policy, or explicit note that the slice is platform-only.", "required": true },
    { "id": "spacetime", "type": "code", "title": "SpacetimeDB slice", "description": "Rows, repositories, mappers, reducers, views, or reconciliation changes.", "required": true },
    { "id": "verification", "type": "test", "title": "Verification", "description": "Tests, builds, or review notes for behavior and boundaries.", "required": true }
  ],
  "validations": [
    {
      "id": "slice-boundary-review",
      "type": "manual",
      "title": "Confirm slice boundary",
      "required": true,
      "when": "before-task",
      "criteria": [
        "The slice is classified as rich domain, thin domain service, or platform-only before editing.",
        "Existing domain, spacetime, table, reducer, view, and repository conventions are identified."
      ]
    },
    {
      "id": "cargo-fmt-check",
      "type": "command",
      "title": "Run Rust formatter check",
      "required": true,
      "when": "after-task",
      "shell": "bash",
      "command": "cargo fmt --check",
      "success": { "exitCode": 0 }
    },
    {
      "id": "cargo-test",
      "type": "command",
      "title": "Run Rust tests",
      "required": true,
      "when": "after-task",
      "shell": "bash",
      "template": true,
      "command": "{{ task.input.testCommand }}",
      "success": { "exitCode": 0 }
    },
    {
      "id": "domain-slice-review",
      "type": "agent",
      "title": "Review SpacetimeDB domain slice",
      "required": true,
      "when": "after-task",
      "context": {
        "ppp": {
          "requiredSlugs": [
            "validation.spacetimedb-domain-slice-checks",
            "antipattern.spacetimedb-domain-hidden-in-reducer"
          ],
          "includeBody": true,
          "blockTypes": ["markdown", "list", "checklist"]
        }
      },
      "passCriteria": [
        "Reducers contain platform orchestration rather than hidden business decisions.",
        "Domain logic remains pure Rust when the slice has domain rules.",
        "Table access and storage identity stay behind repositories and mappers.",
        "Relevant tests or explicit infeasibility notes are present."
      ]
    }
  ],
  "sections": [
    {
      "id": "target",
      "type": "requirements",
      "title": "Target Slice",
      "blocks": [
        {
          "type": "markdown",
          "template": true,
          "markdown": "Implement `{{ task.input.reducerName }}` in slice `{{ task.input.sliceName }}` for behavior: {{ task.input.behavior }}."
        }
      ]
    },
    {
      "id": "instructions",
      "type": "instructions",
      "title": "Agent Instructions",
      "blocks": [
        {
          "type": "list",
          "template": true,
          "ordered": true,
          "items": [
            "Inspect the existing module wiring, domain mirror, SpacetimeDB slice, repository, mapper, reducer, authz, and view conventions before editing.",
            "Classify the slice as rich domain, thin domain service, or platform-only; do not create a domain aggregate when there are no invariants to protect.",
            "Put new domain rules in pure domain code and keep `spacetimedb` imports out of that code.",
            "Add or update rows, indexes, mappers, repositories, reducers, and views in the SpacetimeDB slice as needed.",
            "Use repository functions for table access and indexed lookups; avoid ad hoc full-table scans in hot reducer paths.",
            "Add or update focused tests for domain rules, mapper round trips, reconciliation plans, and lockstep conversions where the change touches them.",
            "Run cargo fmt --check and `{{ task.input.testCommand }}`; run cargo check or spacetime build if feasible, and record any infeasible checks."
          ]
        }
      ]
    },
    {
      "id": "acceptance",
      "type": "acceptance",
      "title": "Acceptance Criteria",
      "blocks": [
        {
          "type": "acceptance",
          "template": true,
          "criteria": [
            { "id": "boundary", "text": "Slice boundary classification is explicit and the implementation follows it.", "required": true, "kind": "review" },
            { "id": "reducer-shape", "text": "Reducer `{{ task.input.reducerName }}` authorizes, loads, calls domain/platform operation, saves, and records side effects explicitly.", "required": true, "kind": "review" },
            { "id": "tests", "text": "`{{ task.input.testCommand }}` and formatter checks were run when feasible.", "required": true, "kind": "test" }
          ]
        }
      ]
    }
  ]
}
